event_date,event_name,event_photo_url,event_purpose,event_report_url,event_tweet_url,event_video_url,has_event_report,latitude,longitude,online_event_url,organisers,place,slug,url,world_region_code,world_region_text
2025-03-06,"""Data at the Crossroads: Exposing polycrisis through migration issues""",,Highlight the importance of data in understanding the key drivers of migration and showcase projects where innovation has enabled collection and analysis of data around these issues and their solutions.,,,,False,14.59906311,-90.49998789,,"Diálogos Guatemala, Email: comunicacion@dialogos.org.gt",Guatemala City,data-at-the-crossroads-exposing-polycrisis-through-migration-issues,https://forms.gle/ZDqnEkESLoAhgZUc9,,
2025-03-07,#Halalan2025 Datathon,,,,,,False,14.676041,121.043701,,,Quezon City,halalan2025-datathon,,,
2025-03-04,#オープンデータスゴイ 可視化ハッカソン Round4 振り返り,,オープンデータの活用と整備をコミュニティドリブンで推進します！,,,,False,139.6917,35.6894,,VIZZIES (https://sites.google.com/view/opendatasugoi/),東京都（オンライン）,opundetasugoi-ke-shi-hua-hatukason-round4-zhen-rifan-ri,https://techplay.jp/event/973641,,
2025-03-01,2025 Winnipeg Open Data Datathon,,Learn to use the City of Winnipeg Open Data Portal.,,,,False,49.895138,-97.138374,,Winnipeg Open Data Meet-Up Group,Winnipeg,2025-winnipeg-open-data-datathon,https://www.meetup.com/winnipeg-open-data-meet-up-group/events/305884765/,,
2025-03-15,[TM] Open Data Day 2025,,,,,,False,45.748871,21.208679,,contact@opendataday.ro,"Timisoara, Romania",tm-open-data-day-2025,https://tm.opendataday.ro,,
2025-03-02,ABOUDOU ALI Faoziath,,"The objective of this event is to reveal and celebrate the skills of web professionals in Parakou, by highlighting their talent and their contribution to the digital development of the region.",,,,False,9.343099,2.62575,,,PARAKOU,aboudou-ali-faoziath,https://www.linkedin.com/posts/faoziath-aboudou-ali_bonsoir-%C3%A0-tous-nous-voila-dans-le-mois-de-activity-7170731228428509184-vmZZ?utm_source=share&utm_medium=member_desktop&rcm=ACoAAEK_OkMBVRjJYAQM87ypP6JH2O8-S-MzJNs,,
2025-03-07,Avance de datos abiertos en Ecuador y reconocimiento a buenas prácticas en lo público,,"Promover el uso y aplicación de los datos abiertos en el Ecuador, así como otorgar un reconocimiento a las instituciones que utilizan los datos abiertos para generar valor público",,,,False,-0.181097,-78.486749,,"Ministerio de Telecomunicaciones, Fundación de Ayuda por Internet",Quito,avance-de-datos-abiertos-en-ecuador-y-reconocimiento-a-buenas-practicas-en-lo-pu,https://forms.office.com/r/MVsmxtZing,,
2025-02-21,Azad-on on ODD,,عدالت اجتماعی، داده‌های آزاد، اهداف و راهکارها,,,,False,35.699434,51.338097,,Azad-on (Mostafa Ahangarha),Tehran (or online),azad-on-on-odd,https://azad-on.com,,
2025-03-04,Bogotá se mueve por la Transparencia,,"es el lanzamiento del portal ""Datos por la transparencia”, un sitio web que reúne los visores y tableros producidos por diferentes entidades del Distrito para promover la consulta pública y el control social.

En este espacio te mostraremos cómo navegar en el nuevo portal y exploraremos con expertos(as) la apuesta estratégica de Datos para la Transparencia en el empoderamiento ciudadano y en la transformación digital del Distrito.",,,,False,4.598206,-74.072703,,Secretaria General de la Alcaldía Mayor de Bogotá correo: comunigab@alcaldiabogota.gov.co,"Bogota D.C, Colombia ",bogota-se-mueve-por-la-transparencia,,,
2025-03-04,BOGOTÁ SE MUEVE POR LA TRANSPARENCIA: LANZAMIENTO DEL PORTAL DATOS PARA LA TRANSPARENCIA ,,"El lanzamiento del portal ""Datos por la transparencia”, un sitio web que reúne los visores y tableros producidos por diferentes entidades del Distrito para promover la consulta pública y el control social.

En este espacio te mostraremos cómo navegar en el nuevo portal y exploraremos con expertos(as) la apuesta estratégica de Datos para la Transparencia en el empoderamiento ciudadano y en la transformación digital del Distrito.",,,,False,4.598096,-74.0727,,Secretaria General de la Alcaldía Mayor de Bogotá en colaboración con la Red de Observatorios del Distrito de Bogotá ,Bogotá D.C Localidad la Candelaria ,bogota-se-mueve-por-la-transparencia-lanzamiento-del-portal-datos-para-la-trans,,,
2025-03-07,Build With AI Workshop 2025,,"This Build with AI event will feature many technical workshops and is aimed to help developers learn and apply their skills on GenAI trends and products, and make them employable. ",,,,False,6.32744,8.10636,,"Google Developer Group Abakaliki, Community leader - Victor Ekeghe Mba (+2349138636493) (Victorekesnr@gmail.com). Event assistant: Adaeze Lucy Daniel (+2349013870845) (Adalucydaniel@gmail.com). ","Abakaliki, Ebonyi State, Nigeria. ",build-with-ai-workshop-2025,https://gdg.community.dev/e/m5gdaq/,,
2025-03-01,Building Local Developer Capacity in Open Data and Air Quality Monitoring in Kinshasa.,,"To equip 20 local developers with the skills to leverage open data for air quality monitoring in Kinshasa, fostering data-driven solutions for environmental challenges and informed policy-making.",,,,False,-4.321529,15.311853,,OKFN Regional Coordination for Francophone Africa,Kinshasa,building-local-developer-capacity-in-open-data-and-air-quality-monitoring-in-kin,,,
2025-03-04,Celebrating International Open Data Day 2025,,"In introduction to finding, using, and creating open data in a Scottish context ",,,,False,57.151007,-2.099087,,Code The City,"Aberdeen, UK",celebrating-international-open-data-day-2025,https://ti.to/code-the-city/adm-mar-2025,,
2025-03-06,Coastal Resilience through Mangrove Rehabilitation: Geospatial Data to Action,,"The event assesses coastal vulnerability, identifies priority mangrove rehabilitation sites using geospatial data, and validates findings through fieldwork and community engagement to enhance coastal resilience.",,,,False,-7.494647,107.33246,,Bandung Mapper,"Cianjur Regency, West Java, Indonesia",coastal-resilience-through-mangrove-rehabilitation-geospatial-data-to-action,,,
2025-03-05,Conference on datas collection ,,Getting more knowledges to a'data collections and learning our to uploaded it ,,,,False,-2.50316,28.85309,,Crispin Ngakani ,"Bukavu, Democratic Republic of Congo ",conference-on-datas-collection,,,
2025-03-01,Contra Costa County Open Government Day,,"Extract, collect, analyze, and visualize local government data for cities and districts across Contra Costa County.",,,,False,37.8937797,-122.0626805,,Contra Costa Taxpayers Association,"Walnut Creek, CA, USA",contra-costa-county-open-government-day,https://cocotax.org/event-5980148,,
2025-03-07,Critical Data for Change : Ghana 2025,,"To promote open-source and open-data collection in Ghana on critical issues like soil pollution from illegal mining (galamsey) and children's disabilities, while fostering partnerships for data reuse and funding.",,,,False,5.57742,-0.232548,,d-Node,Accra,critical-data-for-change-ghana-2025,https://d-node.com,,
2025-03-07,Data Resilience USenghor,,"Our project aims to raise awareness among African professionals at Université Senghor about open data as a development tool and polycrisis response, tailored to their specialties and skills.",,,,False,31.270542,30.046003,,Club Numerik,"Alexandrie, Egypt",data-resilience-usenghor,,,
2025-03-07,Datathon: DEI in the Public Sphere,,"Participants will collaboratively define, measure, and evaluate DEI in the public sphere.",,,,False,37.54792358,127.0441614,,Parti Co-op,Seoul,datathon-dei-in-the-public-sphere,https://pass.campaigns.do/posts/rDtvY5X,,
2025-03-06,Datenlehrpfad im Rahmen der Open Data Days Wien 2025,,"Am 6. März richtet die Stadt Wien den Open Data-Lehrpfad aus. Diese Initiative zielt darauf ab, „Veränderungen in der Stadt mit Hilfe von Daten“ aufzuzeigen. Der Lehrpfad endet auch 2025 mit einem Besuch im Parlament, wo Expert:innen der Parlamentsdirektion und der Universität Wien Einblicke in das erweiterte Open Data-Angebot des Parlaments geben.
Den Abschluss der Veranstaltung bildet eine Führung durch das historische Gebäude mit besonderem Fokus auf die Parlamentsdaten.",,,,False,48.208176,16.373819,,FH Technikum Wien,Wien,datenlehrpfad-im-rahmen-der-open-data-days-wien-2025,https://www.technikum-wien.at/events/open-data-expo-2025/,,
2025-02-06,Datos Abiertos para enfrentar la Policrisis,,Promover el uso de datos abiertos en la comunidad estudiantil de la Licenciatura en Estadística e Ingeniería en Ciencia de Datos y en otras disciplinas,,,,False,19.527281,-96.9235,,"Facultad de Estadística e Informática, Universidad Veracruzana - Lorena López Lozada - lorlopez@uv.mx","Xalapa, Veracruz, México",datos-abiertos-para-enfrentar-la-policrisis,https://www.uv.mx/linae/datosa2025/,,
2025-03-05,Datos y bielas: 15va edición especial Open Data Day “Datos abiertos para afrontar la policrisis”,,"En esta 15ª Edición, nos enfocamos en datos abiertos para afrontar la policrisis desde dos enfoques: el riesgo climático y la crisis democrática. El primero abarca crisis globales como el cambio climático, la inflación, la polarización política y social, y las tensiones geoeconómicas. El segundo enfoque considera grandes cambios ocurridos durante el 2024 "" el año de las elecciones"", destacando el cambio en la política de varios países y el aumento de gobiernos autoritarios y negacionistas, lo que ha exacerbado la crisis política mundial.",,,,False,-0.199479,-78.488112,,Fundación Datalat y Fundación Openlab,Quito,datos-y-bielas-15va-edicion-especial-open-data-day-datos-abiertos-para-afronta,,,
2025-03-22,Dia dos Dados Abertos - Maceió 2025,,"1. Estimular diversas redes em Alagoas a discutir sobre dados abertos; 2. Estreitar os laços entre potenciais estudantes, pesquisadores e profissionais da área de dados abertos; 3. Desenvolver coletivamente eventos permanentes sobre o tema.",,,,False,9.66522,35.73571,,LabHacker - Laboratório Brasileiro de Cultura Digital,Maceió,dia-dos-dados-abertos-maceio-2025,,,
2025-03-07,Digitaliza Tu Ciudad,,"Educate about open data, georeferenced services and open databases that serve as the basis for the development of smart cities. It is also a gateway event for wikimedia foundation projects",,,,False,10.20267,-67.57431,,Centro Latinoamericano de Investigaciones Sobre Internet,Maracay,digitaliza-tu-ciudad,https://digitalizate.clisi.org/,,
2025-03-07,Discovering NYC Open Data,,"Join this virtual class to learn about the history of NYC Open Data, how to use it, and how to get involved in the community",,,,False,40.712778,-74.006111,,NYC's Office of Data Analytics and BetaNYC (ambassadors@open-data.nyc),New York City,discovering-nyc-open-data,https://nyc.gov/discoveropendata,,
2025-03-06,Données ouvertes et santé : un levier pour l'autonomisation des jeunes en Guinée,,Promouvoir l’utilisation des données ouvertes pour sensibiliser les jeunes et les acteurs locaux aux défis de la polycrise et renforcer leur engagement dans des solutions basées sur l’open data.,,,,False,44.733662,9.73189,,Organisateur de l'événement : Secours et Vie (SeVie) Adresse e-mail de contact : barryadama2203@gmail.com Tel :+224621364367,"Labé, Guinée",donnees-ouvertes-et-sante-un-levier-pour-l-autonomisation-des-jeunes-en-guinee,,,
2025-03-06,Empowering  Journalists to Leverage Open Data for Climate and Agricultural Reporting,,"To equip rural journalists in Imo State Nigeria to use open data for impactful reporting on climate change and agriculture, in order to drive awareness and solutions.",,,,False,5.494235,7.033391,,"Harsco Media and Communications, Harriet Ijeomah (","Owerri, Imo State Nigeria",empowering-journalists-to-leverage-open-data-for-climate-and-agricultural-repor,,,
2025-03-06,Escuelas en el mapa: Un camino hacia la resiliencia,,Using open mapping of schools and learning spaces to boost resilience and crisis preparedness.,,,,False,4.074631,-73.584101,,Asociación de Cartografía Colaborativa de Colombia - AC3,"Villavicencio, Meta.",escuelas-en-el-mapa-un-camino-hacia-la-resiliencia,https://wiki.openstreetmap.org/wiki/ES:Colombia/Proyecto/ODD2025,,
2025-03-01,Experiencias del Datatón: Economía de Cuidados,,"Es un espacio que busca compartir, comentar y retroalimentar la experiencia de los proyectos que participaron en el  Datatón: Economía de Cuidados 2024 convocado por Estado Abierto del INFO CDMX junto con 20 organizaciones e instituciones. ",,,,False,19.406361,-99.187224,,"Estado Abierto, INFO CDMX",Ciudad de México,experiencias-del-dataton-economia-de-cuidados,,,
2025-03-02,"Floods, Smog, Wildfires: Decoding Thailand's Endless Disaster with Data",,"Enhance conversation about open data by providing data-driven approach to Thailand’s ""polycrisis"", disaster management",,,,False,13.7525,100.533058,,"WeVis, Punch Up, ThaiPBS, The Active, Policy Watch, 101PUB","SCBX NEXT TECH, Siam Paragon, Bangkok, Thailand",floods-smog-wildfires-decoding-thailand-s-endless-disaster-with-data,https://www.facebook.com/share/p/1KKNcw34X5/,,
2025-03-07,From data to metadata: enhancing quality across borders,,"We aim to enhance the quality of open data and metadata across borders by sharing expert insights, best practices, and fostering dynamic discussions on international challenges and opportunities.",,,,False,49.815273,6.129583,,data.europa.eu and Open Knowledge Foundation. Contact email: lisa.voshol@capgemini.com,Online,from-data-to-metadata-enhancing-quality-across-borders,https://data.europa.eu/en/news-events/events/webinar-data-metadata-enhancing-quality-across-borders,,
2025-03-04,Geolocalisation et audit des déchets plastique au bord du fleuve Wouri a Douala ,,"Sensibilisation , collecte et audit des déchets plastique a Douala au Cameroun ",,,,False,4.02373167,9.751425,,Ecowaste and Open Knowledge Cameroon,Rivers Wouri ,geolocalisation-et-audit-des-dechets-plastique-au-bord-du-fleuve-wouri-a-douala,,,
2025-02-03,GeoSkills Training for Climate Action: Empowering Youth with Spatial Data Tools,,To equip university students with practical skills in using OSMAnd for data collection and utilizing open data from OpenStreetMap through QuickOSM in QGIS for map-making and spatial analysis.,,,,False,-15.803069,35.027418,,Spatial Girls Network,"Blantyre, Malawi. ",geoskills-training-for-climate-action-empowering-youth-with-spatial-data-tools,,,
2025-03-06,GESAN Open Data & Mapathon 2025,,"To bridge Nepal’s geospatial skills gap by providing hands-on training in open data analysis and humanitarian mapping, enhancing disaster resilience and empowering local communities.",,,,False,28.2539,83.9764,,Geomatics Engineering Students' Association of Nepal,Pokhara,gesan-open-data-mapathon-2025,https://www.facebook.com/gesan2014,,
2025-03-09,GIS SKILLS SHARING WITH LOCAL PEOPLE TO STRENGTHEN LOCAL OPEN MAPPING IN ZAMBIA,,"We are trying to build a very strong OSM Community in Zambia, this includes  sharing strong skills apart from remote edits, we want to have a very sustainable OSM community in Zambia and ensure the open mapping continues.",,,,False,-14.29216,28.559759,,LOCAL KNOWLEDGE MAPPERS ORG,"Lusaka, Zambia",gis-skills-sharing-with-local-people-to-strengthen-local-open-mapping-in-zambia,https://forms.gle/mGXb6Zn2pnWgdrWz8,,
2025-03-07,Govdirectory Collab Hour - Open Data Day 2025,,Show how open data makes a difference for government access.,,,,False,59.605542,14.476268,,Govdirectory,Online,govdirectory-collab-hour-open-data-day-2025,https://www.wikidata.org/wiki/Event:Govdirectory_Collab_Hour_-_Open_Data_Day_2025,,
2025-03-07,Green Mapping MeetUp: Climate Café & OpenData for Sustainability,,"A community gathering where people share vegan food, discuss climate solutions, and use open data to map eco-friendly businesses—empowering action to reduce CO₂ emissions",,,,False,47.912115,106.927269,,"Public Lab Mongolia, tsenguun.t@publiclabmongolia.org, 99225102",Ulaanbaatar,green-mapping-meetup-climate-cafe-opendata-for-sustainability,https://facebook.com/events/s/green-mapping-meetup-climate-c/1110622944140462/,,
2025-03-31,Green Open Data Day (ou Dia Verde dos Dados Abertos),,"Estão previstas atividades presenciais e remotas, pensadas para despertar para a importância dos dados abertos na dimensão ecológica, para fins de colaboração para a conservação ambiental e a melhoria da qualidade de vida dos habitantes, frente às consequências evidentes da crise climática, que têm piorado as condições ambientais nas cidades e levado ao aumento da pressão por recursos, especialmente, os energéticos.",,,,False,-22.74312,-43.706081,,"Raquel Dezidério Souto (UFRJ) (dra.raquel.souto@gmail.com), Dr, Manoel Fernandes (UFRJ), DRa. Danielle Cintra (UFF), Dr. Gustavo de Sousa (UFRRJ)",Seropédica,green-open-data-day-ou-dia-verde-dos-dados-abertos,https://ivides.org/green-open-data-day,,
2025-03-05,Hackaton: Flooding and lanslides impact to local comunity's social life,,The main objective of this hackathon is to provide ideas and identification/mapping of the impacts caused by flooding and landslides.,,,,False,-4.273897,15.281513,,"Crispin Ngakani - Climate Clock DRC; cngakani01@gmail.com, climateclock8@gmail.com","Uvira, Democratic Republic of Congo",hackaton-flooding-and-lanslides-impact-to-local-comunity-s-social-life,,,
2025-04-04,Hackday 2025,,We are celebrating the 10th anniversary of the Open Data Days in Moers with a program for administration and civil society.,,,,False,51.453323,6.625245,,Stephan Bernoth,Moers,hackday-2025,https://www.moers.de/veranstaltungen/hackday-2025,,
2025-03-05,Harnessing Open Data for Resilient women Communities Addressing Poverty Inequality and Climate Crises,,"Our event aims to harness open data to empower women-led communities, driving solutions for poverty, inequality, and climate crises through collaboration, innovation, and data-driven resilience.",,,,False,11.44034,79.644999,,Society for Women's Education and Awareness Development,"SWEAD skill training center, Bhuvanagiri, Cuddalore District, Tamilnadu , India ",harnessing-open-data-for-resilient-women-communities-addressing-poverty-inequali,https://www.sweadindia.org/home/open-data-day-open-day-foundation-2025,,
2025-03-07,Harnessing Opportunities to address Polycrisis through community Engagement (HOPE),,Raise awareness among marginalized and indigenous communities about the disproportionate impacts of the poly-crisis by leveraging open data.,,,,False,11.051882,-0.244328,,Nepal Institute of Research and Communications (NIRC),Ilam Municipality,harnessing-opportunities-to-address-polycrisis-through-community-engagement-hop,https://www.facebook.com/events/2403305353370340,,
2025-03-26,Hudson Valley Open Data Hackathon,,"Join us for an exciting half-day hackathon focused on leveraging New York State's Open Data resources using cutting-edge AI technologies and open-source tools. This event brings together developers, data scientists, civic tech enthusiasts, and public sector innovators to create impactful solutions for our communities.",,,,False,42.731134,-73.68315,,"OpenHubProject.com, festival@openhubproject.com","Rensselaer Polytechnic Institute (RPI), 110 Eighth Street Troy, NY USA 12180",hudson-valley-open-data-hackathon,https://hvtechfest.com/2025/03/hackathon,,
2025-03-07,IA & Données Ouvertes : Exploiter l'intelligence artificielle pour l'analyse prédictive des crises au Bénin,,Démystifier l'IA pour les participants et Créer des solutions concrètes pour anticiper les crises,,,,False,6.420386,2.337484,,Groupe CTAD (contact@groupectad.com),Abomey-Calavi /BENIN,ia-donnees-ouvertes-exploiter-l-intelligence-artificielle-pour-l-analyse-pre,https://forms.gle/jUXGtiiddYvLdT3k9,,
2025-03-07,Insult Tracker: Presidential Clashes and Twitter Echo,,"To rank and analyze the impact of Argentine President Javier Milei's insults toward journalists by scraping news and Twitter data, measuring frequency, virality, sentiment, and media coverage.",,,,False,-34.597139,-58.381111,,Civil Association for Equality and Justice (ACIJ),Buenos Aires,insult-tracker-presidential-clashes-and-twitter-echo,https://docs.google.com/forms/d/1riFpGfJCtT-yYJTzjtthLrRW2GOBtDoKciqtq2xleOo/,,
2025-03-06,International Open Data Day 2025,,"To promote and disseminate open data by creating opportunities for knowledge sharing, fostering understanding, and developing impactful projects that address social issues through the use of open data.",,,,False,13.88978218,100.571592,,Digital Government Development Agency (Public Organization),Conference Hall at Thailand Institute of Justice (TIJ),international-open-data-day-2025,,,
2025-03-06,International Open Data Day 2025 & Open Data Award,,,,,,False,100.501762,100.501762,,,"Bangkok,Thailand",international-open-data-day-2025-open-data-award,,,
2025-03-01,Know your Right 👍,,"Create awareness of the duties and rights of my community members in issues of life, worship, democracy, environment and Health",,,,False,3.3,4.3,,Kona Center for Peace and Development KC4PD -  konasunday@gmail.com,"Kona Ward, Jalingo Taraba State, Nigeria.",know-your-right,,,
2025-03-07,La escuela mi refugio para afrontar la policrisis,,"Raise awareness among high school students about creating community through open data, and the importance of spatially identifying educational institutions to face the polycrisis.",,,,False,5.321383,-72.389288,,AC3; inbox@ac3.org.co. Doris Carmiña Ruiz; hidrogis24@gmail.com,Yopal Casanare,la-escuela-mi-refugio-para-afrontar-la-policrisis,,,
2025-03-06,La escuela mi refugio para afrontar la policrisis,,"Sensibilizar a los estudiantes de secundaria sobre crear comunidad a traves de los datos abiertos, y la importancia de identificar espacialmente las instituciones educativas para afrontar la policrisis.",,,,False,5.730478,-71.995534,,AC3; inbox@ac3.org.co. Doris Carmiña Ruiz; hidrogis24@gmail.com,Pore Casanare,la-escuela-mi-refugio-para-afrontar-la-policrisis-2,,,
2025-03-04,Las publicaciones científico-académicas de acceso abierto como herramientas para enfrentar la policrisis del siglo XXI: el rol clave de los editores ,,"La conferencia busca reflexionar sobre el rol clave de editores/as de publicaciones de acceso abierto para impulsar soluciones globales ante la policrisis del siglo XXI, con énfasis en América Latina.",,,,False,-34.65274,-58.553593,,Damián Molgaray,"Buenos Aires, Argentina",las-publicaciones-cientifico-academicas-de-acceso-abierto-como-herramientas-para,https://forms.gle/WeJPDFJ1CDuPmJCE6,,
2025-03-01,Les données ouvertes pour une agriculture durable,,Sensibiliser et former les agriculteurs et jeunes entrepreneurs agricoles à l'utilisation des données ouvertes pour améliorer leur production et optimiser la gestion des ressources naturelles.,,,,False,9.3431,2.62575,,Su Wusua Daa ONG ; email: suwusuadaa@gmail.com,Parakou,les-donnees-ouvertes-pour-une-agriculture-durable,https://www.facebook.com/profile.php?id=100080315601957,,
2025-03-21,Les enjeux de la gestion des données de recherche,,Dresser la cartographie des actions menées pour promouvoir et mettre en œuvre la science ouverte afin de développer une stratégie cohérente de valorisation des données et des publications originales des chercheurs,,,,False,5.359952,-4.008256,,"DEA Olivier Stéphane, olivier-stephane.dea@ird.fr / 0757443993",Abidjan,les-enjeux-de-la-gestion-des-donnees-de-recherche,,,
2025-03-03,Let's celebrate Open data day,,We want to share thoughts and discuss about open data and science.,,,,False,17.25,74.15,,"Individual, Himanshu Chaube, himanshuchaube8@gmail.com",Karad,let-s-celebrate-open-data-day,,,
2025-03-06,Leveraging Open Data for Child Advocacy in a Polycrisis Context: The Case of Owerri Municipal Local Government Area of Imo State,,We aim to leverage open data to highlight the impact of polycrisis on children in Owerri Municipal LGA and drive data-driven advocacy for child-friendly policies and interventions.,,,,False,5.489059,7.017588,,Yeshua Care Charity Foundation,Owerri,leveraging-open-data-for-child-advocacy-in-a-polycrisis-context-the-case-of-owe,https://sites.google.com/view/yeshua-care,,
2025-03-06,Liberia Open Data Forum 2025: Harnessing Open Data for Inclusive Solutions,,"Our event aims to promote open data awareness, foster collaboration, and empower communities to leverage data for tackling poverty, inequality, climate challenges, and governance issues, driving sustainable development and informed decision-making in Liberia.",,,,False,6.2907,-10.7605,,West Africa ICT Action Network (WAICTANet) Contact Email: info@waictanet.org /info.waictanet@gmail.com,Monrovia ,liberia-open-data-forum-2025-harnessing-open-data-for-inclusive-solutions,,,
2025-03-03,MapMyCommunity,,"We aim to empower young people with mapping skills to identify and address community issues, fostering data-driven development and sustainable solutions in the Central Region of Ghana.",,,,False,34.184299,-117.320663,,"World Inspiring Network, info@worldinspiringnetwork.org","University of Education, Winneba",mapmycommunity,https://egotickets.com/events/mapmycommunity,,
2025-03-05,Mapping Our Zongo Community,,We aim to conduct an innovative workshop targeted at introducing Open Street Mapping to the youth of Oduman Zongo as a tool to map the community.,,,,False,5.64033,-0.3313,,Open Source Zongo (opensourcezongo@gmail.com),Accra,mapping-our-zongo-community-2,,,
2025-03-05,Mapping Our Zongo community ,,We aim to conduct an innovative workshop targeted at introducing Open Street Mapping to the youth of Oduman Zongo as a tool to map the community.,,,,False,5.64033,-0.3313,,Open Source Zongo (Kabuteyhabib@gmail.com),Accra,mapping-our-zongo-community,,,
