event_date,event_name,event_photo_url,event_purpose,event_report_url,event_tweet_url,event_video_url,has_event_report,latitude,longitude,online_event_url,organisers,place,slug,url,world_region_code,world_region_text
2025-03-07,"Road mapping and accessibility. Contribution to improving urban traffic in Lubango, Angola",,"Updating data on accessibility and road infrastructure in Lubango through OSM, discussing good practices for making streets, pavements and transports more accessible, especially for vulnerable groups (deficient people, elderly, etc)",,,,False,-14.918136,13.485228,,YouthMappers at Huíla (ISCED-Huíla),"Lubango, Angola",road-mapping-and-accessibility-contribution-to-improving-urban-traffic-in-luban,,,
2025-03-07,Science on the 7th Livestream,,Conversation on open data in air quality ,,,,False,42.3555,71.0565,,Health Effects Institute (contactsoga@healtheffects.org),Virtual,science-on-the-7th-livestream,,,
2025-03-07,Science on the 7th: A conversation on Open Data & Air Quality,,"Join us for a conversation between Pallavi Pant (HEI), Chris Hagerbaumer (OpenAQ), and Rafaela Chiminelli Borth (IRIS) to discuss the use of open data to advance air quality work.",,,,False,42.360081,-71.058884,,Health Effects Institute,Online,science-on-the-7th-a-conversation-on-open-data-air-quality,https://www.youtube.com/watch?v=dUtuey-i0oY,,
2025-03-07,SMCoSE GeoChallenge 2025: MapRoulette Edition,,"We aim to enhance open data contributions by engaging mappers in solving geospatial challenges on MapRoulette, fostering collaboration, and promoting the use of open mapping for community impact.",,,,False,-6.795671,37.627634,,SMCoSE YouthMappers Chapter. (smcoseyouthmappers@gmail.com),Morogoro - Tanzania,smcose-geochallenge-2025-maproulette-edition,,,
2025-03-05,Somalia Open Data Day 2025: Unlocking Transparency,,"The purpose of this event is to advocate for the meaningful and effective implementation of open data initiatives by the Somali government to enhance transparency, accountability, and good governance, combat corruption, and foster collaborative dialogue among key stakeholders in Somalia.",,,,False,8.408416,48.483723,,Bareedo Platform,"Garowe, Somalia ",somalia-open-data-day-2025-unlocking-transparency,https://bareedo.org/,,
2025-03-06,Sustainable Development in Crisis Mode: The Role of Open Data in SDGs.,,"Event Purpose:
Exploring how open data can drive sustainable development amid global crises, fostering collaboration, transparency, and actionable insights to accelerate progress toward the SDGs in an era of uncertainty.",,,,False,24.860735,67.001137,,XploreOpen,"Karachi, Pakistan (Virtual)",sustainable-development-in-crisis-mode-the-role-of-open-data-in-sdgs,https://forms.gle/6oaFqiQU5ht2ZRTJ6,,
2025-03-04,Taller de Inteligencia Artificial y Datos Abiertos - GENIA Latinoamérica - Open Data Week Guatemala,,Sensibilizar de las oportunidades para la aplicación de Inteligencia Artificial aprovechando los datos desagregados y conjuntos de datos en Guatemala y/o la región Latinoamericana.,,,,False,14.634915,-90.506882,,Dirección de Gobierno Electrónico de la Comisión Presidencial de Gobierno Abierto y Electrónico,Ciudad de Guatemala,taller-de-inteligencia-artificial-y-datos-abiertos-genia-latinoamerica-open,,,
2025-03-06,The Turing Way Fireside Chat: Nurturing Open Science in Challenging Economic and Political times,,"In this discussion, our panel of experts will discuss how the current political and economic landscape has shaped evolving practices in research and academia, impacting their communities and their own roles, highlighting what steps they are taking to stay resilient.",,,,False,51.507351,-0.127758,,Esther Plomp and Anne Lee Steele (turingway@turing.ac.uk),Online,the-turing-way-fireside-chat-nurturing-open-science-in-challenging-economic-and,http://tinyurl.com/ttw-fireside-chat-mar25,,
2025-03-06,Tracking Resilience of Indigenous Bodies for Environmental Sustainability (TRIBES),,"Harness open data and participatory research in tracking the resilience of indigenous communities facing climate-driven displacement and conflict, ensuring their voices, knowledge systems, and rights are central in shaping sustainable solutions.",,,,False,26.7468,87.1834,,SUMARG NEPAL,Kalabanjar,tracking-resilience-of-indigenous-bodies-for-environmental-sustainability-tribe,https://www.facebook.com/share/p/15H1sMawJu/,,
2025-03-06,Training workshop on setting up an  open data repostiory on emergency crisis (MPOX and Ebola) by  Librarians of public libraries,,To ease access to open data on emergency crisis like  Ebola and Mpox which is currently threatening the lives of Ugandans and the region,,,,False,0.332167,0.285613,,IASSIST - Africa; Dr. Winny Nekesa Akullo  (IASSIST-Africa regional Workshop)- secretariat@iassistafrica.org;nekesawinny@gmail.com; +256782422047,Kampala - Uganda,training-workshop-on-setting-up-an-open-data-repostiory-on-emergency-crisis-mp,http://www.iassistafrica.org,,
2025-03-03,Transformación Digital y Datos Abiertos Como Elemento Clave Para la Transparencia - Open Data Week Guatemala,,"Sensibilizar y capacitar al sector público sobre la importancia de los datos abiertos desagregados en el marco de la transformación digital, para atender eficazmente las demandas ciudadanas de información transparente y detallada.",,,,False,14.6369658,-90.5155807,,Comisión Presidencial de Gobierno Abierto y Electrónico,Ciudad de Guatemala,transformacion-digital-y-datos-abiertos-como-elemento-clave-para-la-transparenci,,,
2025-03-03,Welcome to Switzerland,,"Connect our most active communities in the topics of open data, net neutrality & digital heritage.",,,,False,46.94608,7.43584,,oleg at opendata.ch,Bern,welcome-to-switzerland,https://welcome.dribdat.cc/event/3,,
2025-03-04,WhoFundsThem report launch,,Open data on the influence of money in UK politics. Join us for an exploration into who funds our politicians and how to safeguard democracy.,,,,False,51.507351,-0.127758,,mySociety,Online,whofundsthem-report-launch,https://www.eventbrite.co.uk/e/whofundsthem-report-launch-panel-discussion-registration-1110336840379,,
2025-03-07,WIKI-SHE EVENT RWANDA,,promotion of gender equity and increased representation of women in Wikimedia projects,,,,False,2.2315,30.1483,, Names: CYATUKWIRE Rose    Email: roscy25@gmail.com,Kigali,wiki-she-event-rwanda,https://meta.wikimedia.org/w/index.php?title=User_talk%3AROSEMURA250#WIKI-SHE_EVENT_RWANDA_7th_Mar_25,,
2025-03-08,Wikimediaで山鹿豊前街道を千代に八千代に,,きれいな豊前街道街並みを写真オープンデータで残す,,,,False,33.01693,130.688632,,Code for Kumamoto,"Yamaga-shi, Kumamoto 8610541 JAPAN",wikimediadeshan-lu-li-qian-jie-dao-woqian-dai-niba-qian-dai-ni,https://iodd2025kumamoto.peatix.com/,,
2025-03-08,YOKOHAMA International Open Data Day 2025,,"We plan to invite experts to present sessions on the latest initiatives in the use of open data, EBPM (evidence-based policy making), and improving wellbeing.",,,,False,35.543416,139.575466,,Code for YOKOHAMA,"Yokohama,Japan",yokohama-international-open-data-day-2025,https://yokohama-iodd2025.peatix.com/view,,
2025-03-07,« Maîtriser les Données Libres : de la Collecte à l'Analyse avec des Outils Open Source »,,"Objectifs de la formation :
•	Comprendre le concept de données libres et leurs enjeux.
•	Savoir où et comment accéder à des jeux de données ouverts pertinents.
•	Maîtriser les outils open source pour analyser et visualiser ces données.
•	Appliquer les connaissances acquises à des cas pratiques concrets.
",,,,False,13.555301,2.087073,,MGC SIG CONSULTING,Niamey,maitriser-les-donnees-libres-de-la-collecte-a-l-analyse-avec-des-outils-open,,,
2025-03-01,روز دادهٔ آزاد ۱۴۰۳ - رسانه نرم‌افزار آزاد,,we record a podcast about Open data and play for our subscriber in Peertube and Telegram,,,,False,35.688158,51.365514,,رسانه نرم‌افزار آزاد,Tehran (Online),rwz-ddh-azd-1403-rsnh-nrmfzr-azd,https://t.me/Unrivaledir,,
2025-03-07,روز دادهٔ آزاد ۱۴۰۳ آزادان,,بررسی اهمیت و راهکارهای تولید و استفاده از داده‌های آزاد,,,,False,35.699752,51.338049,,آزادان / مصطفی آهنگرها,Tehran (or online),rwz-ddh-azd-1403-azdn,https://odd1403.azad-on.com/,,
2025-03-03,いまさら聞けないオープンデータの話〜とはから活用まで〜 #OpenDataDay #ODD2025,,自治体職員や地域のデジタル化・スマートシティ推進に関わる方々を対象に、オープンデータの本質を理解し、活用の幅を広げること,,,,False,35.689487,139.691711,,一般社団法人シビックテックジャパン　https://www.civictech.jp/,online,imasarawen-kenaiopundetanohua-tohakarahuo-yong-made-opendataday-odd2025,https://connpass.com/event/344914/,,
2025-03-08,オープンデータデイ2025 in 沖縄,,沖縄の蒸留酒である泡盛とその関連するオープンデータを用いて普及啓発を考える,,,,False,26.21397266,127.6834089,,"Ginowan Teh, Okinawa Open Laboratory","Naha, Okinawa",opundetadei2025-in-chong-nawa,https://ool.connpass.com/event/346438/,,
2025-03-02,オープンデータデイいしかわ2025 OpenDataDay Ishikawa 2025,,オープンデータの啓蒙とデータの利活用、特に地図情報の扱い方の習得,,,,False,36.55295464,136.6484723,,"Kanazawa Civic Tech Committee, Kanazawa City",金沢未来のまち創造館 多目的室1,opundetadeiisikawa2025-opendataday-ishikawa-2025,https://kanazawa-civic-tech.jp/news/1261/,,
2025-03-01,公共交通オープンデータ最前線2025,,公共交通オープンデータの整備・活用などに関する取組紹介・交流,,,,False,35.714125,139.761769,,一般社団法人日本バス情報協会,東京,gong-gong-jiao-tong-opundetazui-qian-xian-2025,https://iodd2025.peatix.com/,,
