event_date,event_name,event_photo_url,event_purpose,event_report_url,event_tweet_url,event_video_url,has_event_report,latitude,longitude,online_event_url,organisers,place,slug,url,world_region_code,world_region_text
2025-03-05,Mapping Resilience – Using QGIS to Analyze La Niña and El Niño Impacts in the Philippines.,,"To equip participants with QGIS skills for mapping La Niña and El Niño impacts, enhancing disaster preparedness, resilience, and data-driven decision-making in the Philippines.",,,,False,8.477609,124.64298,,USTP AGES- YOUTHMAPPERS ustp.youthmappers@gmail.com,Cagayan De oro City,mapping-resilience-using-qgis-to-analyze-la-nina-and-el-nino-impacts-in-the-ph,,,
2025-03-04,Mapping Resilience: Harnessing Open Roads Data for Flood Preparedness in Sunamganj,,"This event will be a crucial step toward ensuring better road data for flood resilience and disaster response. We invite students, researchers, and mapping enthusiasts to contribute to this vital effort. Together, we can create accurate, accessible, and reliable road maps that support communities in times of crisis.",,,,False,23.88272,90.26815,,"YouthMappers at IRS, Jahangirnagar University Chapter",Dhaka,mapping-resilience-harnessing-open-roads-data-for-flood-preparedness-in-sunamga,https://www.facebook.com/share/18n1tz3Roz/,,
2025-03-01,Mapping Sinking Cities,,Mapping of municipalities that are part of the growing Metro Manila sprawl that is experiencing the fastest land subsidence rate and are growingly susceptible to hydrometeorological hazards,,,,False,14.657968,121.071083,,UP Resilience Institute - YouthMappers,Quezon City,mapping-sinking-cities,,,
2025-03-04,Massachusetts E2C Hub's Open Data Day,,"Learn how to find and use open datasets on education and workforce, and build data skills through hands-on activities with support from Education-to-Career Research and Data HUb (E2C Hub) staff.
",,,,False,42.40477,-71.070124,,"Massachusetts Education-to-Career Research and Data Hub, e2chub@mass.gov",Everett MA USA,massachusetts-e2c-hub-s-open-data-day,https://mass.gov/e2c,,
2025-03-04,Meet-up and open discussion: How can companies use open data to help mitigate world’s biggest crises?,,Get people in the business community thinking about how they can utilise open data within their organisation to help the world.,,,,False,51.526279,-0.07804,,Work With Data (contact: ania@workwithdata.com),London,meet-up-and-open-discussion-how-can-companies-use-open-data-to-help-mitigate-wo,https://www.linkedin.com/posts/workwithdata_opendataday-activity-7298002248880586754-P_Vq?utm_source=share&utm_medium=member_desktop&rcm=ACoAACXfHjEBj-tJ4r56sFc3uzxsrEFNagKQd7c,,
2025-03-05,Mesa técnica de co-creación,,Queremos generar soluciones innovadoras para el municipio de Antigua desde la participación y colaboración ciudadana.,,,,False,14.558571,-90.729523,,Municipalidad de Antigua Guatemala,Antigua Guatemala,mesa-tecnica-de-co-creacion,,,
2025-03-04,Missing Maps London Virtual Mapathon,,The aim of the Missing Maps Project is to map the most crisis-prone parts of the world. With your help we can map communities vulnerable to disasters or experiencing poverty. ,,,,False,0.0,0.0,,Nicole Siggins: nicole.siggins@gmail.com,Virtual,missing-maps-london-virtual-mapathon,https://www.tickettailor.com/events/missingmapslondon/1040085,,
2025-03-06,Mujeres en Datos - Open Data Week Guatemala,,Demostrar las oportunidades del uso de datos y su análisis en materia de procesamiento con perspectiva de género en Guatemala para visibilizar las distintas condiciones y problemáticas en el país. ,,,,False,14.6369658,-90.5155807,,Dirección de Gobierno Electrónico de la Comisión Presidencial de Gobierno Abierto y Electrónico,Ciudad de Guatemala,mujeres-en-datos-open-data-week-guatemala,,,
2025-03-07,ODD 2025: THE USE OF GIS IN DETERMINING FLOOD PROTECTION ZONES AND EVACUATION ROUTES IN JANGWANI VALLEY.,,To impower youth and community at large on the use of GIS and open mapping technology,,,,False,6.81492,39.28841,,"Jordan University College (JUCo), Youthmappers;  Email: jmangu360@gmail.com",Dar es salaam,odd-2025-the-use-of-gis-in-determining-flood-protection-zones-and-evacuation-ro,,,
2025-03-28,ODD Belém 2025: Dados Abertos para a COP30,,"Promover a conscientização e o uso estratégico de dados abertos para a COP30, fortalecendo o debate sobre sustentabilidade, inovação e transparência para a construção de políticas públicas baseadas em evidências",,,,False,-1.45498,-48.50227,,"Tatiana Pará, Wallace Pantoja, Marcos Sadala, OSGEO Brasil, Ok Brasil",Belém,odd-belem-2025-dados-abertos-para-a-cop30,https://eventyay.com/e/fb60d2bf,,
2025-03-22,ODD2025 - チャレンジ！しながわの財宝あつめ,,品川のまち中にかくされた財宝をオープンデータをつかってさがす旅にでかけます。,,,,False,35.6182495,139.733351,,Code for Shinagawa (Monopro Shinagawa) / Shinagawa Cleaning Office /  Rissho University,"Shinagawa-ku, Tokyo",odd2025-tiyarenzi-sinagawanocai-bao-atume,https://monopro.tech/,,
2025-03-05,"Open Access, Open Science, Open Data: modern trends & challenges ",,"This webinar is held as part of the International Open Data Day with main topic “Open Data to Tackle the Polycrisis”  in collaboration with the State Scientific and Technical Library of Ukraine, Clarivate, the eIFL Association, Bentham Science Publishers, Odesa National Polytechnic University, and Kharkiv Polytechnic Institute.We invite researchers, university administrators, librarians, and anyone interested in the topics of open science, open access, and research data management.",,,,False,50.447731,30.542721,,State Scientific and Technical Library of Ukraine  ,Kyiv ,open-access-open-science-open-data-modern-trends-challenges,https://dntb.gov.ua/news/webinar,,
2025-06-05,Open Climate Education,,Introduce Senior High School students to open knowledge and climate literacy. The foundations of digital literacy would be a core of the session.,,,,False,6.852027335,-1.384402427,,Open Knowledge Ghana,Asokore Ashanti,open-climate-education,,,
2025-03-05,Open data and artificial intelligence in the Central African Republic,,Inform and raise awareness about the advantages and disadvantages of open data and artificial intelligence in the Central African Republic ,,,,False,4.36969,18.573901,,Centrafrique Tech; SIBIRO Philippe Junior,Bangui - Central Africa Republic,open-data-and-artificial-intelligence-in-the-central-african-republic,https://www.facebook.com/CentrafriqueTech,,
2025-03-07,Open Data Day 2025,,"Promoting transparency and collaboration by advancing the values of open data, highlighting the role of cutting-edge technologies in empowering communities and enhancing access to knowledge.",,,,False,40.640064,22.94442,,OKF Greece,Thessaloniki,open-data-day-2025,,,
2025-03-08,Open Data Day 2025  X Nullfull,,,,,,False,37.53616,126.971624,,Youne,서울특별시 용산구 백범로99길 40 101동 1층(지하),open-data-day-2025-x-nullfull,,,
2025-03-01,Open Data Day 2025 in Côte d’Ivoire,,"Training 10 Ivorians to use open data to map illegal gold-panning sites in Côte d'Ivoire, by producing content on Wikidata and OpenStreetMap.",,,,False,5.413096695,-3.979456892,,Wikimedia Community User Group Côte d’Ivoire  (emmanuelleg22@gmail.com),Abidjan,open-data-day-2025-in-cote-divoire,https://w.wiki/DDX2,,
2025-03-07,Open Data Day 2025 in South Sudan,,"We aim to raise awareness about the power of open data in addressing South Sudan's polycrisis, fostering local collaboration, and empowering communities to use data for sustainable development and conflict resolution.",,,,False,4.843643,31.603356,,Open Knowledge South Sudan,"Juba, South Sudan",open-data-day-2025-in-south-sudan,https://meta.wikimedia.org/wiki/Event:Open_Data_Day_2025_in_South_Sudan,,
2025-03-03,Open Data Day 2025 – Transparent Governance in Municipalities & Well-being Areas: Crisis Resilience Through Open Data,,"We aim to showcase how open municipal and well-being area data can enhance crisis resilience, democratic accountability, and EU-wide data interoperability, ensuring transparent governance and informed decision-making—such as in Finland’s upcoming municipal elections.",,,,False,60.168779,24.923064,,Open Knowledge Finland: joel.holappa@okf.fi & susanna.anas@okf.fi,Helsinki,open-data-day-2025-transparent-governance-in-municipalities-well-being-areas,,,
2025-03-07,"Open Data Day 2025: Clean up UK's rivers, seas and lakes",,Bringing together universities and water companies through open data hacks to stimulate ideas for new products and services that solve complex system level challenges facing the water sector and stakeholders.,,,,False,54.775249,-1.584852,,Stream (in collaboration with several UK universities and water companies) ,Durham,open-data-day-2025-clean-up-uk-s-rivers-seas-and-lakes,https://www.streamwaterdata.co.uk/pages/open-data-day-2025,,
2025-03-06,Open Data Day 2025: Mujeres liderando Datos Abiertos para la Igualdad,,Queremos mostrar el conocimiento y las experiencias sobre los datos abiertos públicos disponibles y las oportunidades de su reutilización para abordar los retos relacionados con la igualdad.,,,,False,41.409908,2.20354,,Iniciativa Barcelona Open Data,Barcelona,open-data-day-2025-mujeres-liderando-datos-abiertos-para-la-igualdad,https://iniciativabarcelonaopendata.cat/es/2025/02/open-data-day-2025-mujeres-liderando-datos-abiertos-para-la-igualdad/,,
2025-03-21,Open Data Day Alagoas 2025 – Dados Abertos para Fortalecer a Transparência e a Participação,,"The event seeks to re-engage the local open data community in Alagoas, promoting debates, training sessions, and collaborations to strengthen transparency and access to public information on a permanent basis for the entire state.",,,,False,-9.66522,-35.73571,,Evelyn Gomes - evelyn@labhacker.org.br,Labhacker Alagoas Space,open-data-day-alagoas-2025-dados-abertos-para-fortalecer-a-transparencia-e-a-p,https://labhacker.my.canva.site/,,
2025-03-04,Open Data Day Aruba - Research Data Management intro and Bring Your Own Data workshop,,"This event provides an introduction into Open Data which will increase awareness of participants of the importance of Open Data, and also provides a space for people to actively work on their data - which can eventually become Open Data.",,,,False,12.52965,-70.032928,,"Esther Plomp (esther.plomp@ua.aw, research@ua.aw)",Oranjestad,open-data-day-aruba-research-data-management-intro-and-bring-your-own-data-wor,,,
2025-03-07,Open Data Day at the NCAS early careers symposium,,To investigate open earth and ocean data sources to emphasise the importance of open data to early career professionals in the atmospheric sciences.,,,,False,53.8,-1.56,,National Centre for Atmospheric Science,"Leeds, UK",open-data-day-at-the-ncas-early-careers-symposium,,,
2025-03-07,Open data day celebration,,to introduce the concept of open data to local tech community ,,,,False,27.185948,56.333064,,Bandar abbas Gnu/Linux User group,"BandarAbbas, Iran",open-data-day-celebration,,,
2025-03-08,Open Data Day Curitiba 2025,,"The event will bring together the local community to explore and research the city's open data, promoting knowledge and engagement among new participants in the use and development of public data.",,,,False,-25.480877,-49.304424,,Terraço Verde e Ricardo Mendes Jr ricardomendesjr@gmail.com,Curitiba,open-data-day-curitiba-2025,https://opendataday.curitiba.br/,,
2025-03-01,Open Data Day Flensburg - rund um Karten und Daten,,"Das OK Lab Flensburg lädt ein zum Open Data Day 2025 – ein Mitmachtag rund um Karten und Daten. In Workshops, Präsentationen und interaktiven Sessions können Teilnehmende mehr über Open Data erfahren und eigene Projekte umsetzen. Der Eintritt ist frei, eine Anmeldung ist nicht erforderlich.",,,,False,54.791612,9.430608,,all@oklabflensburg.de,Flensburg,open-data-day-flensburg-rund-um-karten-und-daten,https://opendataday-flensburg.de,,
2025-03-10,Open Data Day Lagos: Intersecting Africa Open Data with AI,,Our interest is to drive engagement on the need to improve the quality of Africa's public data and the efforts required to ensure accuracy and compatibility with LLMs. ,,,,False,6.485037,3.540882,,BudgIT/Open Knowledge Nigeria,"Civic Hive, Yaba, Lagos",open-data-day-lagos-intersecting-africa-open-data-with-ai,https://docs.google.com/forms/d/1nuZc6aBa2ts9glle3VvvAIa5vp7WryLrLvL_YOtdKXg/viewform?edit_requested=true,,
2025-03-01,Open Data Day Munich 2025,,"A day all about Open Data: lectures and workshops will provide impulses and insights into the multifaceted world of data, and special offers to get to know each other, network and exchange ideas await the participants.",,,,False,48.135124,11.581981,,"City of Munich, byte - The Bavarian Agency for Digital Affairs, OK Lab Munich",Muncih,open-data-day-munich-2025,https://veranstaltungen.muenchen.de/rit/veranstaltungen/open-data-day-muenchen-2025/,,
2025-02-07,Open Data Day Pakistan ,,"Raise Awareness for Open Access, Open Data, and Open Society",,,,False,30.37,69.34,,Pak Education Society / Pakistan Development Network and Shoki Enterprises ,Karachi,open-data-day-pakistan,,,
2025-03-15,Open Data Day POA 2025 - Dia dos Dados Abertos Porto Alegre,,,,,,False,-30.034647,-51.217659,,Instituto de Cultura Digital da Universidade do Vale do Rio dos Sinos (Unisinos) e Afonte Jornalismo de Dados,"Porto Alegre, RS - Brazil",open-data-day-poa-2025-dia-dos-dados-abertos-porto-alegre,https://eventos.unisinos.br/diadosdadosabertospoa/,,
2025-03-01,Open Data Day Skill Acquisition 2025,,We want to teach attendees how to create your first Android app with a project template provided by Android Studio. You use Kotlin and Jetpack Compose to customize your app and lot more.,,,,False,6.32744,8.10636,,"Ivory Uzoma, ivoryuzoma@gmail.com ",Grand Arena Abakaliki ,open-data-day-skill-acquisition-2025,https://www.facebook.com/100089008405854/posts/pfbid033fwJ5TvK2KgZGCC9EFfTkJUdLkWiFDiubui71jfhtGna2EWcRuxR6WL93PV7grYfl/,,
2025-03-07,Open Data Day: Py013 - Baixada Santista,,"Our goal is to engage the local community in exploring open data, fostering collaboration, and inspiring practical applications to address regional challenges in areas like environment, mobility, and governance.",,,,False,-23.965077,-46.332381,,Comunidade Py013 Baixada Santista (comunidade.py013@gmail.com/+5513991063173),Santos,open-data-day-py013-baixada-santista,https://www.sympla.com.br/preview/ca0b25d96144cfe93f2a1aad1587c00b,,
2025-03-05,Open Data et gouvernance des ressources minières au Kasaï-Oriental,,"L'objectif de l'évènement consiste à sensibiliser la société civile, les médias à l'importance de la transparence dans la gouvernance minière au Kasaï-Oriental. En même temps,  les jeunes seront outillés sur leur rôle dans l'analyse des données ouvertes liées dans l'exploitation du diamant. Et à la fin, l'évènement aura pour mission de proposer des suggestions et recommandations pour l'amélioration de la gouvernance par le truchement des données ouvertes. ",,,,False,60809.0,233523.0,,"Yali RDC, représenté par Marcel Tshibangu",Mbujimayi,open-data-et-gouvernance-des-ressources-minieres-au-kasai-oriental,https://us05web.zoom.us/j/84661004350?pwd=lgMrmY4XvFY1Vrd3TQBpu0NO2X5zVM.1,,
2025-03-05,Open Data Expo 2025,,"Anlässlich des internationalen Open Data Days 2025 laden die FH Technikum Wien und die Wirtschaftsagentur Wien zur 4. Open Data Expo am 5. März 2025 ein. Auch in diesem Jahr lautet das Motto “Daten erleben und begreifen”. Dabei werden zahlreiche Anwendungen und Projekte präsentiert, die auf öffentlich zugänglichen Daten basieren. Teilnehmer*innen der Open Data Expo haben die Möglichkeit, in 3 Gruppen zu je 20 Personen die Zentrale des Wiener Luftmessnetzes zu besuchen. Zusätzlich werden Workshops angeboten.",,,,False,48.208176,16.373819,,FH Technikum Wien,Wien,open-data-expo-2025,https://www.technikum-wien.at/events/open-data-expo-2025/,,
2025-03-05,Open Data for a Resilient Dodoma,,"To empower communities, researchers, and policymakers in Dodoma to use open data for tackling urban, environmental, and governance challenges through GIS, mapping, and data-driven decision-making.",,,,False,-6.133728,35.73918,,OpenGeoCity Tanzania,"Dodoma, Tanzania",open-data-for-a-resilient-dodoma,,,
2025-03-05,"Open Data for AI-Enhanced Flood Risk Mapping in Choba, Nigeria",,"We aim to create an AI-enhanced flood risk map, train 50+ participants in open mapping, and provide open geospatial data to support disaster resilience and urban planning in Choba.",,,,False,4.8917,6.9075,,"YouthMapper, Uniport chapter ","Choba, Rivers State, Nigeria",open-data-for-ai-enhanced-flood-risk-mapping-in-choba-nigeria,https://forms.gle/Em2KEzp4Rf1ZGf2e8,,
2025-03-08,Open Data for Data Science Education & Innovation,,Fostering open-data culture among data science learners for collaboration and innovation.,,,,False,10.49023797,7.430195424,,"Peter Okwukogu, peter.okwukogu@gmail.com",Kaduna city in Nigeria,open-data-for-data-science-education-innovation,,,
2025-03-05,Open Data for Education: Bridging Gaps and Building Futures,,"This event will explore how open data can be leveraged to address educational challenges, improve access to quality education, and empower citizens to advocate for better learning outcomes. The event will also empower citizens to take an active role in addressing learning crises through open data, fostering a more informed and engaged community committed to improving education for all.",,,,False,8540.0,11220.0,,"The name of the organisation organising the event is: Initiative for Community and Human Development in Taraba (ICHD), Email: ichd4u@gmail.com ","The event will take place in Jalingo, Taraba State, Northeast Nigeria",open-data-for-education-bridging-gaps-and-building-futures,,,
2025-03-05,Open Data for Education: Bridging Gaps and Building Futures,,"The purpose of the event ""Open Data for Education: Bridging Gaps and Building Futures"" is to empower citizens, educators, and students to use open data as a tool to address educational challenges and improve learning outcomes in their communities.",,,,False,85359.99,112159.99,,Initiative for Community and Human Development in Taraba (ICHD),"Jalingo, Taraba State, Nigeria",open-data-for-education-bridging-gaps-and-building-futures-2,,,
2025-03-07,Open Data for Local Resilience,,"The event aims to equip fragile communities with open data solutions for economic empowerment, social cohesion and disaster mitigation for sustainable development at the grassroots. ",,,,False,8.89369,11.35765,,Organization: African Resilient Initiative for Community & Sustainable Development(AfRICOSUD). Email: onyeka.nwigwe1@gmail.com,"Jalingo, Taraba state",open-data-for-local-resilience,https://forms.gle/gQ7NAJ3czTFEKJCB6,,
2025-03-07,"Open Data for Resilience: Tackling Poverty, Inequality, and Crisis Through Collaboration",,"Empower communities by leveraging open data to address the intersection of poverty, inequality, violence, and climate crises, fostering innovative solutions for resilience and equitable development.",,,,False,-15.387526,28.322817,,Women in Data Science and AI Zambia Chapter,Lusaka,open-data-for-resilience-tackling-poverty-inequality-and-crisis-through-colla,,,
2025-03-06,Open data for women in sport and gender equality,,,,,,False,3.848032,11.502075,,Gender data journalists network,Yaoundé,open-data-for-women-in-sport-and-gender-equality,,,
2025-03-06,Open data for women in sport and gender equality,,Sensibiliser les journalistes et la société civile sur l'importance des données ouvertes dans la promotion de l'Egalité des sexe dans le sport. ,,,,False,3.848032,11.502075,,Gender Data Journalists Network,Yaoundé,open-data-for-women-in-sport-and-gender-equality-2,,,
2025-03-14,Open Data HackDays,,Workshops and Hacks with local OpenData,,,,False,49.012009,8.42452,,"OK Lab Karlsruhe, Stadt Karlsruhe  odd@ok-lab-karlsruhe.de","Karlsruhe, Germany",open-data-hackdays,https://ok-lab-karlsruhe.de/projekte/odd25/,,
2025-03-04,Open Data Network Map for Disaster in Turkey,,"We will create a network diagram for open data that can be used to disaster works in Turkey. This map will include actors, relationships among them and presence of open data (quantitative and qualitative).",,,,False,41.00824,28.978359,,Open Data and Technology Association,İstanbul is a metropolitan city and has great historical places and architectural building that belong to various imperial era. It has university,open-data-network-map-for-disaster-in-turkey,,,
2025-03-05,Open Data Showcase,,,,,,False,38.892062,-77.019912,,US Department of Education/Cassidy Harry; Cassidy.Harry@ed.gov,Virtual ,open-data-showcase,https://www.linkedin.com/redir/redirect?url=https%3A%2F%2Flnkd%2Ein%2FetN4tWFX&urlhash=F8Me&trk=public_post-text,,
2025-03-04,Open Delta: Unlocking Economic Growth Through Data,,"To showcase how open data can drive economic growth, improve governance, and empower citizens by making critical information accessible, transparent, and actionable for all stakeholders in Delta State.",,,,False,6.21932163,6.69029946,,Paul Okoro,"Asaba, Delta State, Nigeria",open-delta-unlocking-economic-growth-through-data,https://bit.ly/opendeltaevent,,
2025-03-03,Open Geographical Data to Tackle the Polycrisis in West Africa,,"The event aims to promote the use of open geographical data to enhance crisis resilience, improve decision-making, and foster collaboration among stakeholders in West Africa.",,,,False,7.202647,2.061709,,FONDATION AMANLIZOUN TOGBOLETON,BOHICON,open-geographical-data-to-tackle-the-polycrisis-in-west-africa,,,
2025-03-07,"Open Knowledge during Crisis: Media, Education and mass opinion",,"Raising awareness about the role of open knowledge in national crises, highlighting its impact during political unrest, education reforms, and mass opinion, with insights from the July Revolution in Bangladesh.",,,,False,23.810331,90.412521,,Korikath Knowledge,Dhaka,open-knowledge-during-crisis-media-education-and-mass-opinion,,,
2025-03-01,Opendata day 2025 : Map4Peace in Togo,,"The main objective of our event is to show to participants how open data can help in the fight against insecurity and the risks of violent extremism while promoting peace and social justice in Togo. 
",,,,False,6.185453,1.168044,,Ata Franck Akouete,"Espace YouthLead, Adidogomé Lomé",opendata-day-2025-map4peace-in-togo,https://forms.gle/GrVEma69xYqf5BCm7,,
2025-03-02,OpenDataDay2025　オープンデータ×AI　データ公開で変わる利活用の形OpenDataDay2025　オープンデータ×AI　データ公開で変わる利活用の形,,オープンデータの可能性と課題について議論,,,,False,35.1571849,136.9250943,,Code for Nagoya,名古屋市/オンライン,opendataday2025-opundetaxai-detagong-kai-debian-waruli-huo-yong-noxing-opendataday2025-opundetaxai-detagong-kai-debian-waruli-huo-yong,https://opendataday2025nagoya.peatix.com/,,
2025-03-01,OpenStreetMapの編集とuMapの体験 in 北助松（IODD2025泉大津）,,"Mapping Party and edit uMap in Izumiotsu City,Osaka,Japan",,,,False,34.515755,135.4234,,泉州らへんでオープンデータとGISを楽しむ会泉大津市立北公民館サポーターチーム　泉大津みんなの楽校オープンなデータを楽しむ会,"Izumiotsu City,Osaka,Japan",openstreetmapnobian-ji-toumapnoti-yan-in-bei-zhu-song-iodd2025quan-da-jin,http://blog.livedoor.jp/sensyu_od_gis/archives/43597324.html,,
2025-03-04,"Our data, Our hope",,"Create awareness on the need to improve the quantity, quality and scope of data to accelerate the achievement of sustainable development goals to address priorities areas, and measure progress.",,,,False,13.03702,5.24529,,Resource Connects for Education Initiative,"Sokoto,  Northwest Nigeria",our-data-our-hope,https//www.facebook.com/resourceconnects,,
2025-03-03,OWSD Uniport Branch Open Data Day,,"We aim to promote open data access, fostering collaboration, and enhancing data-driven solutions for sustainable development in the Global South.",,,,False,4.805793,7.006941,,Organisation for Women in Science for the Developing World (OWSD) Uniport Branch,"Port Harcourt, Nigeria",owsd-uniport-branch-open-data-day,,,
2025-03-03,Pari Island Coral Watch: Collaborating for Climate Justice,,"Through citizen science and new coral ecosystem data in small islands. With local communities, we monitor and record coral damage that occurs and foster a spirit of climate justice through storytelling from childhood.",,,,False,-5.85616674,106.6200962,,YAPEKA,"Pari Island, Kepulauan Seribu Regency, Jakarta, Indonesia",pari-island-coral-watch-collaborating-for-climate-justice,,,
2025-03-05,Presentación de Tablero de cumplimiento 6º PAN - Open Data Week Guatemala,,"Realizar el lanzamiento y presentación del Tablero de Avance del 6º Plan de Acción Nacional (PAN) de Gobierno Abierto Guatemala, destacando su papel en la gestión y transparencia de la información para el seguimiento de compromisos, la rendición de cuentas y el combate a la corrupción.",,,,False,14.6369658,-90.5155807,,Comisión Presidencial de Gobierno Abierto y Electrónico,Ciudad de Guatemala,presentacion-de-tablero-de-cumplimiento-6o-pan-open-data-week-guatemala,,,
2025-03-05,REMERI-CUDI Open Data Day 2025,,El propósito del evento es abrir un espacio de reflexión y diálogo sobre la importancia de la gestión y preservación de los datos abiertos y su impacto en las comunidades educativas y de investigación.,,,,False,19.406785,-99.180421,,REMERI-CUDI,México (en línea),remeri-cudi-open-data-day-2025,https://cudi.edu.mx/eventos/foro-remeri-cudi-open-data-day-2025,,
