event_date,event_name,event_photo_url,event_purpose,event_report_url,event_tweet_url,event_video_url,has_event_report,latitude,longitude,online_event_url,organisers,place,slug,url,world_region_code,world_region_text
2026-03-07,2026 Winnipeg Open Data Datathon,,A datathon to demonstrate Smart City ideas using City of Winnipeg Open Data datasets.,,,,False,49.895138,-97.138374,,Winnipeg Open Data Meet-Up Group  (wkwong@delta-y.com),Winnipeg,2026-winnipeg-open-data-datathon,https://www.meetup.com/winnipeg-open-data-meet-up-group/events/312886562/,,
2026-03-06,Hackathon: contributions of data on deforestations and land degradation ,,"By doing this hackathon, I hope to realize a local deforestation map and registering land degradations areas due to disasters, which can help locals students and researchers to find that datas disponibility ",,,,False,-1.658501,29.220455,,"Crispin Ngakani, cngakani01@gmail.com","Goma, Democratic Republic of Congo ",hackathon-contributions-of-data-on-deforestations-and-land-degradation,,,
2026-04-04,Hudson Valley Open Data Hackathon,,"Open Data Hackathon 2026 is designed to turn Hudson Valley data into action with AI. Government agencies: pitch their challenges, get innovative solutions, hire emerging talent. Tech community: solve real problems, build your portfolio, launch careers—or startups. Professionals work alongside students. Hi-tech meets low-tech. One day of collaboration that creates implementable civic innovation. All skill levels welcome. ",,,,False,42.728413,-73.691788,,OpenHub,"Troy, NY",hudson-valley-open-data-hackathon,https://hvtechfest.com/2026/04/hackathon,,
2026-03-07,Les données ouvertes pour améliorer l’accès à l’eau potable dans la commune de Sinendé,,Permettre aux citoyens et acteurs locaux d’analyser et d’utiliser les données ouvertes sur l’eau potable afin d’identifier les insuffisances et formuler des recommandations communautaires basées sur des preuves.,,,,False,10.34441,2.38266,,"SU WUSUA DAA ONG, email: suwusuadaa@gmail.com",Sinendé,les-donnees-ouvertes-pour-ameliorer-lacces-a-leau-potable-dans-la-commune-de-s,https://www.facebook.com/profile.php?id=100080315601957,,
2026-03-05,Open Data Cordoba,,To open maps data for local cities,,,,False,-31.0,-64.0,,ODC,"Mendiolaza, Cordoba, Argentina",open-data-cordoba,,,
2026-03-07,Open Data for Climate Change Action,,Residents can identify climate risks in Ikosi-Ketu using data rather than assumptions by encouraging participants to develop data-informed ideas or actions relevant to Ikosi-Ketu.,,,,False,6.601703,3.384365,,BhondIT Solutions Initiative ,Lagos,open-data-for-climate-change-action,https://www.eventbrite.com/e/open-data-day-2026-climate-action-in-ikosi-ketu-tickets-1981254631938?aff=oddtdtcreator,,
2026-03-05,Some test event,,Some test purpose,,,,False,-31.261623,-64.287505,,Some test organizer,"Cordoba, Argentina",some-test-event,https://opendatacordoba.org,,
2026-03-07,“¿Dónde quedó mi obra?” Taller para vigilar el presupuesto y las obras públicas desde tu colonia,,"Fortalecer la supervisión ciudadana mediante la capacitación en presupuesto y obras públicas, usando datos abiertos y herramientas tecnológicas para rastrear proyectos, comprender el uso de recursos y reportar irregularidades de forma informada.",,,,False,19.43,99.13,,"Concejalía de la Alcaldía Miguel Hidalgo, movimiento.mh.concejalia@gmail.com",Ciudad de México,donde-quedo-mi-obra-taller-para-vigilar-el-presupuesto-y-las-obras-publicas,,,
